{
  "account_ulid": "01KRKHS8RE75RSVRZD958NYQ8T",
  "account_handle_normalized": "OGZ-RETAIL-Reference-037",
  "account_handle_internal": "lhatab_foods",
  "sector": "retail",
  "sub_sector": "",
  "schema_version": 1,
  "profile": {
    "follower_count_bucket": "<10k",
    "bio_voice_summary": "متجر الحطب —  brand, -based.",
    "region_orientation": "najdi-primary"
  },
  "content_patterns_observed": [
    {
      "pattern_ulid": "01KRKHS8RE75RSVRZD958NYQ8V",
      "pattern_name": "new_arrival_reveal",
      "frequency": "weekly",
      "avg_engagement_multiplier": "1.4x",
      "observed_chains_analog": [
        "tf21_02",
        "tf22_05"
      ]
    },
    {
      "pattern_ulid": "01KRKHS8RE75RSVRZD958NYQ8W",
      "pattern_name": "styled_lookbook_carousel",
      "frequency": "biweekly",
      "avg_engagement_multiplier": "1.3x",
      "observed_chains_analog": [
        "tf01_03"
      ]
    },
    {
      "pattern_ulid": "01KRKHS8RE75RSVRZD958NYQ8X",
      "pattern_name": "dressing_room_intimacy",
      "frequency": "monthly",
      "avg_engagement_multiplier": "1.2x",
      "observed_chains_analog": [
        "tf04_05"
      ]
    }
  ],
  "high_engagement_themes": [
    "new collection drops",
    "styling pairings",
    "boutique interior shots"
  ],
  "low_engagement_themes": [
    "generic flat-lay product shots"
  ],
  "distinctive_visual_traits": [
    "editorial fashion lighting",
    "soft pastel or jewel palette",
    "model in elegant pose"
  ],
  "distinctive_voice_traits": [
    "refined modern Saudi",
    "style-led descriptive language"
  ],
  "anti_patterns_observed": [
    "generic flat-lay product shots"
  ],
  "provenance": {
    "source": "internal_research_corpus/OGz_Saudi_Instagram_Benchmarks.xlsx#row_37 + sub_category_template:",
    "date_added": "2026-05-14T15:30:48Z",
    "confirmer": "Mohamed",
    "confidence": "experimental",
    "scope": "sector:retail"
  }
}
