{
  "account_ulid": "01KRKHS8RD0V8H8WRYT9Z4YRG6",
  "account_handle_normalized": "OGZ-RETAIL-Reference-028",
  "account_handle_internal": "lossystone.sa",
  "sector": "retail",
  "sub_sector": "Jewelry / Gemstones",
  "schema_version": 1,
  "profile": {
    "follower_count_bucket": "<10k",
    "bio_voice_summary": "GlossyStone — Jewelry / Gemstones brand, Saudi Arabia-based.",
    "region_orientation": "general-saudi"
  },
  "content_patterns_observed": [
    {
      "pattern_ulid": "01KRKHS8RD0V8H8WRYT9Z4YRG7",
      "pattern_name": "hero_piece_macro",
      "frequency": "weekly",
      "avg_engagement_multiplier": "1.4x",
      "observed_chains_analog": [
        "tf05_01",
        "tf06_03"
      ]
    },
    {
      "pattern_ulid": "01KRKHS8RD0V8H8WRYT9Z4YRG8",
      "pattern_name": "collection_storytelling",
      "frequency": "monthly",
      "avg_engagement_multiplier": "1.5x",
      "observed_chains_analog": [
        "tf22_05"
      ]
    },
    {
      "pattern_ulid": "01KRKHS8RD0V8H8WRYT9Z4YRG9",
      "pattern_name": "custom_inscription_unveil",
      "frequency": "occasional",
      "avg_engagement_multiplier": "1.7x",
      "observed_chains_analog": [
        "tf22_03"
      ]
    }
  ],
  "high_engagement_themes": [
    "new collections",
    "custom pieces",
    "Eid + wedding jewelry"
  ],
  "low_engagement_themes": [
    "flat product-only shots without context"
  ],
  "distinctive_visual_traits": [
    "controlled studio lighting",
    "hand-model close-ups",
    "dark backdrop hero"
  ],
  "distinctive_voice_traits": [
    "refined-premium register",
    "heritage-anchor language",
    "stone-naming detail"
  ],
  "anti_patterns_observed": [
    "flat product-only shots without context"
  ],
  "provenance": {
    "source": "internal_research_corpus/OGz_Saudi_Instagram_Benchmarks.xlsx#row_28 + sub_category_template:Jewelry / Gemstones",
    "date_added": "2026-05-14T15:30:48Z",
    "confirmer": "Mohamed",
    "confidence": "experimental",
    "scope": "sector:retail"
  }
}
