{
  "account_ulid": "01KRKHS8RFCFV3QA82P4D5VZN2",
  "account_handle_normalized": "OGZ-BEAUTY-Reference-009",
  "account_handle_internal": "uregymksa",
  "sector": "beauty",
  "sub_sector": "beauty",
  "schema_version": 1,
  "profile": {
    "follower_count_bucket": "<10k",
    "bio_voice_summary": "PureGym KSA \\ — 100573.0 brand, Fitness / Gym-based.",
    "region_orientation": "najdi-primary"
  },
  "content_patterns_observed": [
    {
      "pattern_ulid": "01KRKHS8RFCFV3QA82P4D5VZN3",
      "pattern_name": "ingredient_reveal_macro",
      "frequency": "weekly",
      "avg_engagement_multiplier": "1.4x",
      "observed_chains_analog": [
        "tf11_03",
        "tf04_01"
      ]
    },
    {
      "pattern_ulid": "01KRKHS8RFCFV3QA82P4D5VZN4",
      "pattern_name": "routine_step_storytelling",
      "frequency": "biweekly",
      "avg_engagement_multiplier": "1.5x",
      "observed_chains_analog": [
        "tf22_03"
      ]
    }
  ],
  "high_engagement_themes": [
    "natural ingredients",
    "routine steps",
    "before/after with disclaimer"
  ],
  "low_engagement_themes": [
    "medical-claim language without clearance"
  ],
  "distinctive_visual_traits": [
    "clean clinical lighting",
    "ingredient close-up",
    "soft pastel + amber palette"
  ],
  "distinctive_voice_traits": [
    "calm-reassuring modern Saudi",
    "ingredient-naming detail"
  ],
  "anti_patterns_observed": [
    "medical-claim language without clearance"
  ],
  "provenance": {
    "source": "internal_research_corpus/OGz_Saudi_Instagram_Benchmarks.xlsx#row_9 + sub_category_template:100573.0",
    "date_added": "2026-05-14T15:30:48Z",
    "confirmer": "Mohamed",
    "confidence": "experimental",
    "scope": "sector:beauty"
  }
}